Region,NAME_1,Provinces,PA Name,Area(has),Priority Level,Definition,Number of Protected Areas,Number of Species,Climate Change Rate,SortRegion,SortNumber of PA,SortSpecies,SortCC
CAR,"Agoo, La Union; Baguio City and Tuba, Benguet","Agoo, La Union; Baguio City and Tuba, Benguet",Marcos Highway Watershed Forest Reserve,"31,542.47",4,Extremely High,15,31,8,Ilocos Region,15,31,7
13,Agusan del Norte,Agusan del Norte,"Alamio, Buayan, Carac-an, Panikian River and Sipangpang Falls Watershed Forest Reserve","43,345.66",3,Very High,12,50,7,Cagayan Valley,12,41,8
13,Agusan del Norte,Agusan del Norte,Cabadbaran Watershed,"15,180.33",3,Very High,12,50,7,Central Luzon,25,31,7
13,Agusan del Sur,Agusan del Sur,Andanan Watershed Forest Reserve,"17,185.63",4,Extremely High,12,50,7,CALABARZON,1,31,6
13,Agusan del Sur,Agusan del Sur,Agusan Marsh  Wildlife Sanctuary,"40,940.96",6,Extremely High  Urgent,12,50,7,Bicol Region,12,38,8
6,Aklan,Aklan,Aklan River Watershed Forest Reserve,"24,131.88",2,High,15,27,6,Western Visayas,15,27,6
5,Albay,Albay,Pigbucan Point to Paron Point Mangrove,194.53,3,Very High,12,38,8,Central Visayas,10,31,8
5,Albay,Albay,Mt Mayon Natural Park,"5,327.15",6,Extremely High  Urgent,12,38,8,Eastern Visayas,8,24,7
6,Antique,Antique,Dalanas River WFR,"7,954.74",1,Insufficient Data,15,27,6,Zamboanga Peninsula,20,15,6
6,Antique,Antique,Northwest Panay Peninsula Natural Park,"12,009.29",4,Extremely High,15,27,6,Northern Mindanao,10,27,6
6,Antique,Antique,Sibalom Natural Park,"6,778.44",4,Extremely High,15,27,6,Davao Region,9,381,7
3,Aurora,Aurora,Dipaculao Watershed Forest Reserve,"2,678.32",1,Insufficient Data,25,31,7,SOCCSKSARGEN,4,13,6
3,Aurora,Aurora,Aurora Memorial  National Park,"6,516.93",2,High,25,31,7,Caraga,12,50,7
3,Aurora,Aurora,Dibalo-Pingit-Zabali-Malayat Watershed  Forest Reserve,"4,571.83",2,High,25,31,7,CALABARZON,12,30,6
3,Aurora,Aurora,Talaytay Protected Landscape,"3,598.31",2,High,25,31,7,ARMM,8,4,7
3,Aurora,Aurora,Amro River Protected Landscape,"6,431.30",3,Very High,25,31,7,CAR,15,31,8
3,Aurora,Aurora,Calabgan Watershed Forest Reserve,"4,629.50",3,Very High,25,31,7,MIMAROPA,15,26,9
3,Aurora,Aurora,Dinadiawan River Protected Landscape,"3,366.54",3,Very High,25,31,7,NCR,4,5,5
3,Aurora,Aurora,Aurora Watershed Forest Reserve,"1,636.75",4,Extremely High,25,31,7,,,,
3,Aurora,Aurora,Simbahan-Talagas Protected Landscape,"2,284.38",4,Extremely High,25,31,7,,,,
CAR,"Balbalan, Kalinga","Balbalan, Kalinga",Banao Protected Landscape,"1,338",2,High,15,31,8,,,,
CAR,"Balbalan, Kalinga; and Apayao","Balbalan, Kalinga; and Apayao",Balbalasang-Balbalan National Park,"1,442.82",4,Extremely High,15,31,8,,,,
9,Basilan,Basilan,Basilan Natural Biotic Area,"4,545.99",4,Extremely High,10,15,6,,,,
3,Bataan,Bataan,Watershed Purposes of Mariveles (Palanas),347.09,1,Insufficient Data,25,31,7,,,,
3,Bataan,Bataan,Bataan National Park,"20,004.17",3,Very High,25,31,7,,,,
3,Bataan,Bataan,Roosevelt Protected Landscape,950.43,4,Extremely High,25,31,7,,,,
2,Batanes,Batanes,Batanes Protected  Landscape & Seascape,"210,687.81",3,Very High,12,41,8,,,,
4A,Batangas,Batangas,Taal Volcano Protected Landscape,"62,292.16",5,Extremely High Critical,12,30,6,,,,
CAR,"Benguet Province; Hungduan and Kiangan, Ifugao; Kayapa, Nueva Viscaya","Benguet Province; Hungduan and Kiangan, Ifugao; Kayapa, Nueva Viscaya",Upper Agno River Basin Resource Reserve,"78,005.32",2,High,15,31,8,,,,
CAR,"Benguet, Ifugao & Mt.Province","Benguet, Ifugao & Mt.Province",Mt. Data National Park,"5,512.05",4,Extremely High,15,31,8,,,,
13,Bislig City,Bislig City,Tinuy-an Falls Protected Landscape,"4,321.75",3,Very High,12,50,7,,,,
7,Bohol,Bohol,Alburquerque-Loay-Loboc Protected Landscape and Seascape,"1,165.51",1,Insufficient Data,10,31,8,,,,
7,Bohol,Bohol,Talibon Group of Islands Protected Landscape and Seascape,"6,446.31",1,Insufficient Data,10,31,8,,,,
7,Bohol,Bohol,Alihawan cansujay Anibongan river WFR,"3,737.44",2,High,10,31,8,,,,
7,Bohol,Bohol,"Island of Catiil, Colangaman, Lomislis, Tagangdio, Tintinan, and islet of Pamasuan",219.27,2,High,10,31,8,,,,
7,Bohol,Bohol,Loboc Watershed Forest Reserve,"8,889.68",3,Very High,10,31,8,,,,
7,Bohol,Bohol,Rajah Sikatuna  Protected Landscape,"10,964.64",3,Very High,10,31,8,,,,
7,Bohol,Bohol,Camotes Island Protected Landscape and Seascape,"1,436.98",4,Extremely High,10,31,8,,,,
7,Bohol,Bohol,"Island of Budlanan, Bugatusan, Panga, Silo, Cabgan, Canconstino, tabaon, Maagpit, and   Islet of Basihan, Bugatusan,  Hayaan, Inanoran , and Poom Point East of Basihan Islet (Getafe Group of Island) (Clarin Group of Island)",38.3,4,Extremely High,10,31,8,,,,
7,Bohol,Bohol,Island of Ambugan / Hambungan & Inabanga River (MSFR),"1,214.59",5,Extremely High Critical,10,31,8,,,,
7,Bohol,Bohol,Panglao Island Protected Seascape,"2,445.08",5,Extremely High Critical,10,31,8,,,,
7,Bohol,Bohol,Chocolate Hills  Natural Monument,"13,994.95",6,Extremely High  Urgent,10,31,8,,,,
CAR,"Buguias, Kabayan, Benguet; Kiangan, Ifugao; & Kayapa, N. Viscaya","Buguias, Kabayan, Benguet; Kiangan, Ifugao; & Kayapa, N. Viscaya",Mt Pulag Protected Landscape,"11,601.89",6,Extremely High  Urgent,15,31,8,,,,
10,Bukidnon,Bukidnon,Mt. Kalatungan Range NP,"22,225.11",4,Extremely High,10,27,6,,,,
10,Bukidnon,Bukidnon,Mt. Kitanglad Range Natural Park,"47,234.20",5,Extremely High Critical,10,27,6,,,,
3,Bulacan,Bulacan,Angat Watershed Forest Reserve  District  (Metro Water District),"54,574.30",1,Insufficient Data,25,31,7,,,,
3,Bulacan,Bulacan,Angat Watershed and Forest Range (Pilot),"6,671.63",2,High,25,31,7,,,,
3,Bulacan,Bulacan,Biak-na-Bato National Park,"2,112.40",3,Very High,25,31,7,,,,
3,Bulacan,Bulacan,Pantabangan-Caranglan Watershed Reservation,"94,864.96",3,Very High,25,31,7,,,,
2,Cagayan,Cagayan,Wangag Watershed Forest Reserve,"6,924.40",1,Insufficient Data,12,41,8,,,,
2,Cagayan,Cagayan,Magapit Protected Landscape,"3,851.15",2,High,12,41,8,,,,
2,Cagayan,Cagayan,Palaui Island Marine Reserve,"8,048.57",3,Very High,12,41,8,,,,
2,Cagayan,Cagayan,Bawa Watershed Forest Reserve,"9,447.17",4,Extremely High,12,41,8,,,,
2,Cagayan,Cagayan,Peñablanca Protected Landscape,"118,653.66",4,Extremely High,12,41,8,,,,
5,Camarines Norte,Camarines Norte,"Mangrove Areas from Del Pilar River to Palita Island, Bo. Salvacion and Dahican","2,420.36",1,Insufficient Data,12,38,8,,,,
5,Camarines Norte,Camarines Norte,Abasig-Matogdon  Mananap Natural Biotic Area,"5,918.31",2,High,12,38,8,,,,
5,Camarines Norte,Camarines Norte,Capalonga Watershed Forest Reserve,358.92,3,Very High,12,38,8,,,,
5,Camarines Norte,Camarines Norte,Dahican Watershed Forest Reserve,42.24,4,Extremely High,12,38,8,,,,
5,Camarines Sur,Camarines Sur,Lagonoy Natural Biotic Area,443.63,2,High,12,38,8,,,,
5,Camarines Sur,Camarines Sur,Caramoan National Park,347.09,3,Very High,12,38,8,,,,
5,Camarines Sur,Camarines Sur,Malabungot Protected Landscape & Seascape,147.71,3,Very High,12,38,8,,,,
5,Camarines Sur,Camarines Sur,Buhi Wildlife Sanctuary,"1,620.71",4,Extremely High,12,38,8,,,,
5,Camarines Sur,Camarines Sur,Libmanan Caves National Park,18.52,4,Extremely High,12,38,8,,,,
5,Camarines Sur,Camarines Sur,"Tanglar point to Bicol river up to the islands of Lahay, Locsuhin, Haponan, Quinabungan, Lamit and Batan","3,141.83",4,Extremely High,12,38,8,,,,
5,Camarines Sur,Camarines Sur,Island of  Basot and Quinalaang,"3,583.98",5,Extremely High Critical,12,38,8,,,,
5,Camarines Sur,Camarines Sur,Mt. Isarog Natural Park,"10,090.89",5,Extremely High Critical,12,38,8,,,,
10,Camiguin,Camiguin,Mt. Timpoong Hibok-hibok Natural Monument,"2,203.39",6,Extremely High  Urgent,10,27,6,,,,
5,"Camrines Norte, Camarines Sur","Camrines Norte, Camarines Sur",Bicol Natural Park,"5,466.35",2,High,12,38,8,,,,
6,Capiz,Capiz,Pan-ay River WFR,"4,076.56",3,Very High,15,27,6,,,,
6,Capiz,Capiz,Jalaur River Watershed Forest Reserve,"9,463.36",4,Extremely High,15,27,6,,,,
5,Catanduanes,Catanduanes,Catanduanes Watershed Forest Reserve,"48,924.05",2,High,12,38,8,,,,
4A,"Cavite, Batangas","Cavite, Batangas",Mts. Palay-palay-Mataas-na-Gulod,"3,972.70",3,Very High,12,30,6,,,,
7,Cebu,Cebu,Guadalupe Mabugnao Mainit Hot Spring National Park,62.34,2,High,10,31,8,,,,
7,Cebu,Cebu,Island of Bantayan,"11,259.58",3,Very High,10,31,8,,,,
7,Cebu,Cebu,Central Cebu Protected Landscape,"28,488.57",4,Extremely High,10,31,8,,,,
7,Cebu,Cebu,Olango Island Wildlife Sanctuary,"1,382.30",4,Extremely High,10,31,8,,,,
7,"Cebu,Negros Occidental,Negros Oriental","Cebu,Negros Occidental,Negros Oriental",Tañon Strait Protected Seascape,"534,589.05",5,Extremely High Critical,10,31,8,,,,
11,Compostela Valley,Compostela Valley,Aliwagwag Protected Landscape,"10,261.07",2,High,9,13,7,,,,
11,Compostela Valley,Compostela Valley,Mainit Hotspring Protected Landscape,"1,422.63",3,Very High,9,13,7,,,,
11,Cotabato,Cotabato,Mt. Apo Natural Park,"64,111.47",6,Extremely High  Urgent,9,13,7,,,,
ARMM,Cotabato,Cotabato,Mado Hot Spring National Park,48.73,4,Extremely High,8,4,7,,,,
11,Davao,Davao,"Mangrove From Baculin Point to Lakud Point, From Tanuip Point to Quinablangan Island and Samal Island","1,849.03",4,Extremely High,9,13,7,,,,
11,Davao City,Davao City,Malagos Watershed Reservation,235.34,3,Very High,9,13,7,,,,
11,Davao del Sur,Davao del Sur,Mabini Protected Landscape and Seascape,"7,292.62",5,Extremely High Critical,9,13,7,,,,
11,Davao Oriental,Davao Oriental,Baganga  Protected Landscape,114.87,3,Very High,9,13,7,,,,
11,Davao Oriental,Davao Oriental,Mati Protected Landscape,884.46,4,Extremely High,9,13,7,,,,
11,Davao Oriental,Davao Oriental,Pujada Bay Protected Landscape/Seascape,"20,873.43",4,Extremely High,9,13,7,,,,
11,Davao Oriental,Davao Oriental,Mt. Hamiguitan Range Wildlife Sanctuary,"7,137.40",6,Extremely High  Urgent,9,13,7,,,,
8,Eastern Samar,Eastern Samar,Guiuan Protected Landscape/Seascape,"66,725.26",2,High,8,24,7,,,,
6,"Guimaras, Iloilo","Guimaras, Iloilo",Taklong Island National Marine Reserve,"1,143.57",3,Very High,15,27,6,,,,
1,Ilocos Norte,Ilocos Norte,Ilocos Norte Metro Watershed Forest Reserve,"2,247.74",1,Insufficient Data,15,31,7,,,,
1,Ilocos Norte,Ilocos Norte,Tanap Watershed Forest Reserve,303.3,1,Insufficient Data,15,31,7,,,,
1,Ilocos Norte,Ilocos Norte,Paoay Lake National Park,378.78,3,Very High,15,31,7,,,,
1,Ilocos Norte,Ilocos Norte,Kalbario-Patapat Natural Park,"3,903.19",4,Extremely High,15,31,7,,,,
1,Ilocos Sur,Ilocos Sur,Northern Luzon Heroes Hill National Park,"5,397.30",1,Insufficient Data,15,31,7,,,,
1,Ilocos Sur,Ilocos Sur,Bigbiga Protected  Landscape,142.87,2,High,15,31,7,,,,
1,Ilocos Sur,Ilocos Sur,Lidlidda Banayoyo Protected Landscape,"1,042.29",2,High,15,31,7,,,,
1,Ilocos Sur,Ilocos Sur,Libunao Protected  Landscape,47.15,3,Very High,15,31,7,,,,
1,Ilocos Sur,Ilocos Sur,Santa Watershed Forest Reserve,27.17,3,Very High,15,31,7,,,,
1,Ilocos Sur,Ilocos Sur,Bessang Pass Natural Monument/Landmark,581.05,4,Extremely High,15,31,7,,,,
1,Ilocos Sur,Ilocos Sur,Salcedo Protected Landscape,196.33,4,Extremely High,15,31,7,,,,
1,Ilocos Sur,Ilocos Sur,Tirad Pass Protected Landscape,7507.6,5,Extremely High Critical,15,31,7,,,,
6,IloIlo,IloIlo,Maasin WFR,"6,539.95",2,High,15,27,6,,,,
6,IloIlo,IloIlo,Bulabog-Putian national Park,889.25,3,Very High,15,27,6,,,,
2,Isabela,Isabela,Isabela (Monte-alto Timber Resouce Corporation Parcel (1 & 2) *Indicative*,"1,139.24",1,Insufficient Data,12,41,8,,,,
2,Isabela,Isabela,Fuyot Springs National Park,"1,160.30",2,High,12,41,8,,,,
2,Isabela,Isabela,Tumauini Watershed Forest Reserve,"6,509.38",4,Extremely High,12,41,8,,,,
2,Isabela,Isabela,Northern Sierra Madre Natural Park,"356,969.32",6,Extremely High  Urgent,12,41,8,,,,
1,La Union,La Union,Agoo-Damortis Protected Landscape & Seascape,"10,774.68",2,High,15,31,7,,,,
1,La Union,La Union,Naguilian Watershed Reservation,86.78,4,Extremely High,15,31,7,,,,
4A,Laguna,Laguna,Pagsanjan Gorge National Park,166.52,4,Extremely High,12,30,6,,,,
4A,"Laguna, Quezon, Rizal and Bulacan","Laguna, Quezon, Rizal and Bulacan","Unnamed National Park, Wildlife Sanctuary and Game Preserve (PP 1636)","115,447.63",3,Very High,12,30,6,,,,
10,Lanao del Norte,Lanao del Norte,Mangrove Areas from Liangan River to Lipatan River of the Municipality of Lapayan,191.16,2,High,10,27,6,,,,
10,Lanao del Norte,Lanao del Norte,Mt. Inayawan Range Natural Park,"4,236.18",4,Extremely High,10,27,6,,,,
ARMM,Lanao del Sur,Lanao del Sur,Pantuwaraya Lake National Park *Indicative*,19.12,1,Insufficient Data,8,4,7,,,,
ARMM,Lanao del Sur,Lanao del Sur,Rungkunan National Park *Indicative*,967.73,1,Insufficient Data,8,4,7,,,,
ARMM,Lanao del Sur,Lanao del Sur,Salikata National Park *Indicative*,659.64,1,Insufficient Data,8,4,7,,,,
ARMM,Lanao del Sur,Lanao del Sur,Lake Dapao National Park,998.13,3,Very High,8,4,7,,,,
ARMM,Lanao del Sur,Lanao del Sur,Lake Lanao Watershed Reservation,"171,292.80",4,Extremely High,8,4,7,,,,
ARMM,Lanao del Sur,Lanao del Sur,Lake Butig National Park,35.32,5,Extremely High Critical,8,4,7,,,,
8,Leyte,Leyte,"Mangrove Areas along Coastline of Dupon Bay from Sacay point to Mouth of Dupon River, Apali Point to Calunganan Point Puerto Bello Lao Mangrove from Bo. Tuban and Bo. Manpagui Santa Cruiz","2,737.60",2,High,8,24,7,,,,
8,Leyte,Leyte,Kuapnit Balinsasayao National Park,376.84,3,Very High,8,24,7,,,,
8,Leyte,Leyte,MacArthur Landing National Park,6.78,3,Very High,8,24,7,,,,
8,Leyte,Leyte,Palompon WFR,"5,631.04",3,Very High,8,24,7,,,,
8,Leyte,Leyte,Cuatro Islas Protected Landscape/Seascape,"11,407.46",4,Extremely High,8,24,7,,,,
8,Leyte,Leyte,Lake Danao Natural Park,"2,244.11",4,Extremely High,8,24,7,,,,
8,Leyte,Leyte,Mahagnao Volcano Natural Park,340.82,5,Extremely High Critical,8,24,7,,,,
ARMM,Maguindanao,Maguindanao,South Upi Watershed Forest Reserve,"1,738.62",3,Very High,8,4,7,,,,
ARMM,Marawi City,Marawi City,"Sacred Mountain National Park ""FLBD Output""",89.61,2,High,8,4,7,,,,
MIMAROPA,Marinduque,Marinduque,"Island of Sta Cruz and Salomague, foreshoreline of dapdap and alabo to the mouth of tagum river, malinoa creek to salomague point, foreshoreline of Barrio Cabuyagan to eastern side of Dating Bayan RIver in Calancan Bay","2,351.44",1,Insufficient Data,15,26,9,,,,
MIMAROPA,Marinduque,Marinduque,Torrijos WFR,157.84,2,High,15,26,9,,,,
MIMAROPA,Marinduque,Marinduque,Marinduque Wildlife Sanctuary,"9,759.60",3,Very High,15,26,9,,,,
5,Masbate,Masbate,Island of Dampalit,16.53,1,Insufficient Data,12,38,8,,,,
5,Masbate,Masbate,Bongsalay Natural  Park,518.91,2,High,12,38,8,,,,
5,Masbate,Masbate,Island of Guinauycan and Pobre,150.92,2,High,12,38,8,,,,
5,Masbate,Masbate,"Malaquing River to Mabunga River, Cueva Point to Kimartinez Point, Kabugao Point to Kabalog Andang Point (Mangrove)",446.58,2,High,12,38,8,,,,
5,Masbate,Masbate,Island of Majaba and Napayuan,440.83,3,Very High,12,38,8,,,,
5,Masbate,Masbate,Chico Island Wildlife Sanctuary,7.84,4,Extremely High,12,38,8,,,,
5,Masbate,Masbate,Naro Island Wildlife Sanctuary,110.01,4,Extremely High,12,38,8,,,,
5,Masbate,Masbate,Ticao Burias Pass Protected Seascape,"413,745.30",5,Extremely High Critical,12,38,8,,,,
10,Misamis Occidental,Misamis Occidental,Barrio Bagumbang to Malautan River (mangrove),543.2,1,Insufficient Data,10,27,6,,,,
10,Misamis Occidental,Misamis Occidental,Baliangao Protected Landscape/Seascape,315.5,2,High,10,27,6,,,,
10,Misamis Occidental,Misamis Occidental,Mt. Malindang Natural  Park,"52,423.51",6,Extremely High  Urgent,10,27,6,,,,
10,Misamis Oriental,Misamis Oriental,Mahugunao Watershed Forest Reserve,147.24,2,High,10,27,6,,,,
10,Misamis Oriental,Misamis Oriental,Mimbilisan Protected Landscape,106.83,3,Very High,10,27,6,,,,
10,Misamis Oriental,Misamis Oriental,Mt. Balatukan Range Natural Park,"8,437.87",3,Very High,10,27,6,,,,
10,Misamis Oriental,Misamis Oriental,Initao-Libertad Protected Landscape and Seascape,921.02,4,Extremely High,10,27,6,,,,
6,Negros Occidental,Negros Occidental,Kabangkalan WFR,416.86,2,High,10,27,6,,,,
6,Negros Occidental,Negros Occidental,Ilog-Hilabangan Watershed Forest Reserve,"10,475.57",3,Very High,15,27,6,,,,
6,Negros Occidental,Negros Occidental,Sagay Marine Reserve,"32,515.05",4,Extremely High,15,27,6,,,,
6,Negros Occidental,Negros Occidental,Northern Negros Natural Park,"70,826.16",5,Extremely High Critical,15,27,6,,,,
6,"Negros Occidental,Negros Oriental","Negros Occidental,Negros Oriental",Mt. Kanlaon Natural Park,"23,559.76",6,Extremely High  Urgent,15,27,6,,,,
7,Negros Oriental,Negros Oriental,Balinsasayao Twin Lakes Natural Park,"8,016.05",4,Extremely High,15,31,8,,,,
7,Negros Oriental,Negros Oriental,Apo Island Protected Landscape/Seascape,691.4,5,Extremely High Critical,10,31,8,,,,
12,North Cotabato,North Cotabato,Lake Buluan GRBS,"8,367.36",1,Insufficient Data,10,13,7,,,,
12,North Cotabato,North Cotabato,Libungan WFR,"52,820.56",3,Very High,4,13,7,,,,
8,Northern Samar,Northern Samar,Biri Larosa Protected Landscape/Seascape,"32,284.14",2,High,4,24,7,,,,
8,Northern Samar,Northern Samar,Samar Island Natural Park,"335,105.57",6,Extremely High  Urgent,8,24,7,,,,
3,Nueva Ecija,Nueva Ecija,Talavera Watershed Reservation,"27,486.49",2,High,8,31,7,,,,
3,Nueva Ecija,Nueva Ecija,Doña Remedios – General Tinio Watershed,"20,930.85",3,Very High,25,31,7,,,,
3,"Nueva Ecija, Bulacan","Nueva Ecija, Bulacan",Minalungao National Park,"2,018.37",4,Extremely High,25,31,7,,,,
2,Nueva Vizcaya,Nueva Vizcaya,Salinas Natural Monument,"5,966.05",1,Insufficient Data,25,41,8,,,,
2,Nueva Vizcaya,Nueva Vizcaya,Bangan Hill National Park,13.08,2,High,12,41,8,,,,
2,Nueva Vizcaya,Nueva Vizcaya,Dupax Watershed Reservation,338.52,3,Very High,12,41,8,,,,
2,"Nueva Vizcaya, Quirino, and Aurora","Nueva Vizcaya, Quirino, and Aurora",Casecnan Protected Lanscape,"86,246.77",5,Extremely High Critical,12,41,8,,,,
MIMAROPA,Occidental Mindoro,Occidental Mindoro,Calavite & F.B. Harrison Game Refuge and Bird Sanctuary,"106,479.07",2,High,12,26,9,,,,
MIMAROPA,Occidental Mindoro,Occidental Mindoro,Mt. Calavite Wildlife Sanctuary,"18,172.69",3,Very High,15,26,9,,,,
MIMAROPA,Occidental Mindoro,Occidental Mindoro,Apo Reef Natural Park,"15,799.23",6,Extremely High  Urgent,15,26,9,,,,
MIMAROPA,Occidental Mindoro &  Oriental Mindoro,Occidental Mindoro &  Oriental Mindoro,Mts. Iglit-Baco National Park,"106,655.50",5,Extremely High Critical,15,26,9,,,,
MIMAROPA,Oriental Mindoro,Oriental Mindoro,Naujan Lake National Park,"15,326.45",2,High,15,26,9,,,,
MIMAROPA,Oriental Mindoro,Oriental Mindoro,"Mangrove areas along banks of Mamburao River, Buluangan River to Lagarum River, Naujan, bank of Betel Creek, Sablayan Pt. to Bagong Sabang RIver, Labangan to Calalayuan Pt. Sukol River, Casiliga River, Island of Soguicay",997.42,4,Extremely High,15,26,9,,,,
MIMAROPA,Palawan,Palawan,Palawan Flora and Fauna WFR (Parcel 2),"3,240.29",2,High,15,26,9,,,,
MIMAROPA,Palawan,Palawan,Palawan Flora and Fauna WFR (Parcel 1),"4,799.18",3,Very High,15,26,9,,,,
MIMAROPA,Palawan,Palawan,Calauit Island Game Preserve and Wildlife Sanctuary,"3,701.62",4,Extremely High,15,26,9,,,,
MIMAROPA,Palawan,Palawan,Malampaya Sound Protected Landscape,"201,018.26",4,Extremely High,15,26,9,,,,
MIMAROPA,Palawan,Palawan,Palawan Game Refuge and Bird Sanctuary – Proc 219,"1,088,181.26",4,Extremely High,15,26,9,,,,
MIMAROPA,Palawan,Palawan,El Nido Managed  Resource Protected Area,"91,954.96",5,Extremely High Critical,15,26,9,,,,
MIMAROPA,Palawan,Palawan,Rasa Island Wildlife Sanctuary,"1,994.84",5,Extremely High Critical,15,26,9,,,,
MIMAROPA,Palawan,Palawan,Entire Province of Palawan – Proc 2152,"55,471.17",6,Extremely High  Urgent,15,26,9,,,,
MIMAROPA,Palawan,Palawan,Mt. Mantalingahan Protected Landscape,"121,886.57",6,Extremely High  Urgent,15,26,9,,,,
MIMAROPA,Palawan,Palawan,Puerto Princesa Underground RIver,"21,908.63",6,Extremely High  Urgent,15,26,9,,,,
MIMAROPA,Palawan,Palawan,Tubbataha Reefs Natural  Park,"451,600.56",6,Extremely High  Urgent,15,26,9,,,,
3,Pampanga,Pampanga,Mt. Arayat Protected Landscape,"3,726.50",2,High,15,31,7,,,,
1,Pangasinan,Pangasinan,Manleluag Spring Protected Landscape,"1,938.83",1,Insufficient Data,25,31,7,,,,
1,Pangasinan,Pangasinan,Hundred Island NP,"1,762.11",5,Extremely High Critical,15,31,7,,,,
4A,Quezon,Quezon,Calauag Watershed Forest Reserve,306.98,1,Insufficient Data,15,30,6,,,,
4A,Quezon,Quezon,Binahaan River Watershed Forest Reserve,476.27,2,High,12,30,6,,,,
4A,Quezon,Quezon,Lopez Watershed Forest Reserve,440.56,2,High,12,30,6,,,,
4A,Quezon,Quezon,"Palsabangan River up to Mazintuto River, Bacong River to Sandoval Point (Mangrove)",866.59,2,High,12,30,6,,,,
4A,Quezon,Quezon,Buenavista Protected Landscape,287.24,3,Very High,12,30,6,,,,
4A,Quezon,Quezon,"Island of Polilio, Alabat, Cabelete, Jomalig, Patnanongan, Kalotkot, Kalongkooan, Palasan, Calabao, Icol and San Rafael","4,750.43",3,Very High,12,30,6,,,,
4A,Quezon,Quezon,Maulawin Spring Protected Landscape,183.15,3,Very High,12,30,6,,,,
4A,Quezon,Quezon,Tibiang-Damagandong Watershed Forest Reserve,274.47,3,Very High,12,30,6,,,,
4A,Quezon,Quezon,Alabat Watershed Forest Reserve,316.88,4,Extremely High,12,30,6,,,,
4A,Quezon,Quezon,Infanta Watershed Forest Reserve,479.78,4,Extremely High,12,30,6,,,,
4A,Quezon,Quezon,Mulanay Watershed Forest Reserve,29.66,4,Extremely High,12,30,6,,,,
4A,Quezon,Quezon,Polilio Watershed Forest Reserve,125.98,4,Extremely High,12,30,6,,,,
4A,Quezon,Quezon,Island of Alibijaban / Alibijaban Island PLSS,"1,072.34",5,Extremely High Critical,12,30,6,,,,
4A,Quezon,Quezon,Quezon Protected Landscape,"1,042.85",5,Extremely High Critical,12,30,6,,,,
4A,"Quezon, Laguna","Quezon, Laguna",Mts. Banahaw- San Cristobal PL,"11,310.61",5,Extremely High Critical,12,30,6,,,,
2,Quirino,Quirino,Quirino Protected Landscape,"183,364.76",2,High,12,41,8,,,,
4A,Rizal,Rizal,Pamitinan Protected Landscape,609.15,2,High,12,30,6,,,,
4A,Rizal,Rizal,Hinulugan Taktak Protected Landscape,3.58,3,Very High,12,30,6,,,,
4A,Rizal,Rizal,Upper Marikina River Basin Protected Landscape,"26,125.64",4,Extremely High,12,30,6,,,,
MIMAROPA,Romblon,Romblon,Sibuyan Island (Mangrove),504.71,2,High,15,26,9,,,,
MIMAROPA,Romblon,Romblon,"Calatrava, San Andres, San Agustin WFR","2,614.28",3,Very High,15,26,9,,,,
MIMAROPA,Romblon,Romblon,Mt. Guiting-Guiting  Natural Park,"15,515.22",6,Extremely High  Urgent,15,26,9,,,,
8,Samar,Samar,Calbayog-Pan-As Hayiban Protected Landscape,"5,067.93",2,High,8,38,7,,,,
5,Sorsogon,Sorsogon,"Putiao River to Malbog River, Getumbro pt. to Prieto Diaz, Panuntingan Pt. to Tagdon River, Sinagbatan Bay to Mantay Pt.","2,593.46",4,Extremely High,12,13,8,,,,
5,Sorsogon,Sorsogon,Bulusan Volcano Natural Park,"3,641.57",5,Extremely High Critical,12,13,8,,,,
12,"South Cotabato, Sarangani","South Cotabato, Sarangani",Mt. Matutum  Protected Landscape,"13,947.00",6,Extremely High  Urgent,4,13,7,,,,
12,"Sultan Kudarat, South Cotabato","Sultan Kudarat, South Cotabato",Allah Valley WFR,"98,533.65",3,Very High,4,13,7,,,,
ARMM,Sulu,Sulu,Mt. Dajo National Park,212.42,4,Extremely High,8,4,7,,,,
13,Surigao del Norte,Surigao del Norte,"Island of Lamagon(Lamayan), Cepaya and Cobeton",586.71,1,Insufficient Data,12,50,7,,,,
13,Surigao del Norte,Surigao del Norte,Surigao WFR,951.93,2,High,12,50,7,,,,
13,Surigao del Norte,Surigao del Norte,"Island of Awasan, Cabilan, Capaquian, Sugbuhan and Tagboaba","4,671.57",3,Very High,12,50,7,,,,
13,Surigao del Norte,Surigao del Norte,Siargao Protected Landscape/Seascape,"283,974.76",5,Extremely High Critical,12,50,7,,,,
9,Tawi Tawi,Tawi Tawi,Turtle Islands Wildlife Sanctuary,"242,958.28",6,Extremely High  Urgent,10,15,6,,,,
CAR,"Tuba, Itogon, Benguet and Baguio City; San Manuel and San Nicolas, Pangasinan","Tuba, Itogon, Benguet and Baguio City; San Manuel and San Nicolas, Pangasinan",Lower Agno Watershed Forest Reserve,"39,082.28",3,Very High,15,31,8,,,,
3,Zambales,Zambales,Lake Malimanga Bird and  Fish Sanctuary,22.86,1,Insufficient Data,25,31,7,,,,
3,Zambales,Zambales,Olongapo Naval Base Perimeter,4.6,1,Insufficient Data,25,31,7,,,,
3,Zambales,Zambales,Masinloc and Oyon  Bay Marine Reserve,"7,558.13",3,Very High,25,31,7,,,,
3,Zambalez,Zambalez,Olongapo WFR,"6,293.50",2,High,25,31,7,,,,
9,Zamboanga City,Zamboanga City,Pasonanca Natural Park,"12,102.08",4,Extremely High,10,15,6,,,,
9,Zamboanga del Norte,Zamboanga del Norte,Siocon Resource Reserve,855.59,1,Insufficient Data,10,15,6,,,,
9,Zamboanga del Norte,Zamboanga del Norte,Jose Rizal Memorial Protected Landscape,474.82,2,High,10,15,6,,,,
9,Zamboanga del Norte,Zamboanga del Norte,Aliguay Island  Protected Landscape/Seascape,"1,188.39",3,Very High,10,15,6,,,,
9,Zamboanga del Norte,Zamboanga del Norte,Murcielagos Island Protected Landscape and Seascape,100.4,3,Very High,10,15,6,,,,
9,Zamboanga del Norte,Zamboanga del Norte,Selinog Island  Protected Landscape and Seascape,959.41,4,Extremely High,10,15,6,,,,
9,Zamboanga del Sur,Zamboanga del Sur,Buug Natural Biotic Area,"1,261.46",2,High,10,15,6,,,,
9,Zamboanga del Sur,Zamboanga del Sur,"Mangrove Areas in Tumalong Bay, Baong River, Pongca Bay,Mangrove in Pisan, Sagayapan, Tintauan and Sacol Island","8,989.55",2,High,10,15,6,,,,
9,Zamboanga del Sur,Zamboanga del Sur,Dumanquilas Protected Landscape/Seascape,"26,112.21",3,Very High,10,15,6,,,,
9,Zamboanga del Sur,Zamboanga del Sur,Mangrove Areas from Tagasilay to the Mouth of Tigbao River including east of Vitali Island,"2,660.81",4,Extremely High,10,15,6,,,,
9,Zamboanga del Sur,Zamboanga del Sur,Mount Timolan Protected Landscape,"2,244.54",4,Extremely High,10,15,6,,,,
9,Zamboanga del Sur,Zamboanga del Sur,Great and Little Sta. Cruz Islands Protected Landscape & Seascape,"1,827.16",5,Extremely High Critical,10,15,6,,,,
9,Zamboanga Sibugay,Zamboanga Sibugay,Naga-Kabasalan Protected Landscape,"5,505.45",3,Very High,10,15,6,,,,
