7,,,"Island of Pamusuan, Handayan, Majanay,,, Islets of Bonoon, Lapinig, Pinahon and Lapinig Chico,,, Mangrove areas east of Soom River Pangpang**","2,850.75",3,Very High,10,31,8,,,,
12,,,Sarangani Bay Protected Seascape,"210,887.69",4,Extremely High,4,13,7,,,,
13,,,"Island of Dinagat, Hikdop, Sibate and Hanigad","1,898.02",3,Very High,12,50,7,,,,
13,,,Island of Rasa,293.04,3,Very High,12,50,7,,,,
13,,,"Mangrove Areas along Municipalities of Lavigan, Valencia Up to Taon River Municipality of Barcelona,, Islands of Masopelid, Mahaba, Condona, Bayagnan, Bilabid and Caye","1,310.62",3,Very High,12,50,7,,,,
"2,3,4A,5",,,Philippine Rise Marine Resource Reserve,"357,903.10",6,Extremely High  Urgent,12,31,6,,,,
CAR,,,Cassamata Hill National Park,55.15,2,High,15,31,8,,,,
NCR,,,Manila Bay Beach Resort,464.66,1,Insufficient Data,4,5,4,,,,
NCR,,,Ninoy Aquino Parks & Wildlife Center,23.85,2,High,4,5,4,,,,
NCR,,,Luneta Park,16.04,3,Very High,4,5,4,,,,
NCR,,,LPPCHEA (aka Las Piñas-Parañaque Wetlands,181.61,5,Extremely High Critical,4,5,4,,,,
